mysql> use sse;
Database changed
mysql> show tables;
+-----------------+
| Tables_in_sse   |
+-----------------+
| department_view |
| dwpartment_view |
| emp             |
| faculty         |
| faculty1        |
| marks           |
| marks_view      |
| mdept           |
| mentee10        |
| mentees         |
| mentees1        |
| mentees2        |
| mentees3        |
| mentees4        |
| mentees5        |
| mentees6        |
| mentees7        |
| mentees8        |
| mentees9        |
| movies          |
| ndept           |
| per             |
| student         |
| studentdept1    |
+-----------------+
24 rows in set (0.00 sec)

mysql> create table Employee1(Emp_id int(4),Emp_name varchar(20),DOB DATE,DOJ DATE,Salary int(4),Address varchar(20),Experience int(1));
Query OK, 0 rows affected (0.00 sec)

mysql> desc Employee1;
+------------+-------------+------+-----+---------+-------+
| Field      | Type        | Null | Key | Default | Extra |
+------------+-------------+------+-----+---------+-------+
| Emp_id     | int(4)      | YES  |     | NULL    |       |
| Emp_name   | varchar(20) | YES  |     | NULL    |       |
| DOB        | date        | YES  |     | NULL    |       |
| DOJ        | date        | YES  |     | NULL    |       |
| Salary     | int(4)      | YES  |     | NULL    |       |
| Address    | varchar(20) | YES  |     | NULL    |       |
| Experience | int(1)      | YES  |     | NULL    |       |
+------------+-------------+------+-----+---------+-------+
7 rows in set (0.00 sec)

mysql>  insert into Employee1 values(100,"Ragini",'2004-02-04','2022-07-18',100000,"Erode",3);
Query OK, 1 row affected (0.01 sec)

mysql> insert into Employee1 values(101,"Radha",'2005-07-16','2022-11-23',150000,"Chennai",5);
Query OK, 1 row affected (0.00 sec)

mysql> insert into Employee1 values(102,"Preethi",'2002-01-16','2021-20-23',150000,"Cuddalore",4);
ERROR 1292 (22007): Incorrect date value: '2021-20-23' for column 'DOJ' at row 1
mysql>  insert into Employee1 values(102,"Preethi",'2002-01-16','2021-9-23',150000,"Cuddalore",4);
Query OK, 1 row affected (0.00 sec)

mysql> insert into Employee1 values(103,"Nani",'2001-03-25','2022-10-15',150000,"Tanjore",2);
Query OK, 1 row affected (0.00 sec)

mysql> insert into Employee1 values(104,"Hussain",'1995-07-15','2019-07-18',102000,"Erode",5);
Query OK, 1 row affected (0.00 sec)

mysql> select*from Employee1
    -> ;
+--------+----------+------------+------------+--------+-----------+------------+
| Emp_id | Emp_name | DOB        | DOJ        | Salary | Address   | Experience |
+--------+----------+------------+------------+--------+-----------+------------+
|    100 | Ragini   | 2004-02-04 | 2022-07-18 | 100000 | Erode     |          3 |
|    101 | Radha    | 2005-07-16 | 2022-11-23 | 150000 | Chennai   |          5 |
|    102 | Preethi  | 2002-01-16 | 2021-09-23 | 150000 | Cuddalore |          4 |
|    103 | Nani     | 2001-03-25 | 2022-10-15 | 150000 | Tanjore   |          2 |
|    104 | Hussain  | 1995-07-15 | 2019-07-18 | 102000 | Erode     |          5 |
+--------+----------+------------+------------+--------+-----------+------------+
5 rows in set (0.00 sec)

mysql>  update Employee1 set Salary=200000 where Address="Tanjore";
Query OK, 1 row affected (0.02 sec)
Rows matched: 1  Changed: 1  Warnings: 0

mysql>  update Employee1 set Salary=200000 where Address="Tanjore";
Query OK, 0 rows affected (0.00 sec)
Rows matched: 1  Changed: 0  Warnings: 0

mysql> select*from Employee1;
+--------+----------+------------+------------+--------+-----------+------------+
| Emp_id | Emp_name | DOB        | DOJ        | Salary | Address   | Experience |
+--------+----------+------------+------------+--------+-----------+------------+
|    100 | Ragini   | 2004-02-04 | 2022-07-18 | 100000 | Erode     |          3 |
|    101 | Radha    | 2005-07-16 | 2022-11-23 | 150000 | Chennai   |          5 |
|    102 | Preethi  | 2002-01-16 | 2021-09-23 | 150000 | Cuddalore |          4 |
|    103 | Nani     | 2001-03-25 | 2022-10-15 | 200000 | Tanjore   |          2 |
|    104 | Hussain  | 1995-07-15 | 2019-07-18 | 102000 | Erode     |          5 |
+--------+----------+------------+------------+--------+-----------+------------+
5 rows in set (0.00 sec)

mysql> create table Edept(Dept_id int(4),Dept_name varchar(20),No_of_Persons int(4))
    -> ;
Query OK, 0 rows affected (0.00 sec)

mysql> insert into Edept values;
ERROR 1064 (42000): You have an error in your SQL syntax; check the manual that corresponds to your MySQL server version for the right syntax to use near '' at line 1
mysql> insert into Edept values
    ->  (1,"Sales",30);
Query OK, 1 row affected (0.00 sec)

mysql>  insert into Edept values(2,"HR",10);
Query OK, 1 row affected (0.00 sec)

mysql>  insert into Edept values(3,"Manufacturing",40);
Query OK, 1 row affected (0.00 sec)

mysql> insert into Edept values(4,"Accounts",20);
Query OK, 1 row affected (0.01 sec)

mysql> select*from Edept;
+---------+---------------+---------------+
| Dept_id | Dept_name     | No_of_Persons |
+---------+---------------+---------------+
|       1 | Sales         |            30 |
|       2 | HR            |            10 |
|       3 | Manufacturing |            40 |
|       4 | Accounts      |            20 |
+---------+---------------+---------------+
4 rows in set (0.00 sec)

mysql> select sum(Salary),min(salary),max(salary),avg(salary) from Employee1;
+-------------+-------------+-------------+-------------+
| sum(Salary) | min(salary) | max(salary) | avg(salary) |
+-------------+-------------+-------------+-------------+
|      702000 |      100000 |      200000 | 140400.0000 |
+-------------+-------------+-------------+-------------+
1 row in set (0.00 sec)

mysql> select Emp_name,Salary from Employee1 where Emp_id=102;
+----------+--------+
| Emp_name | Salary |
+----------+--------+
| Preethi  | 150000 |
+----------+--------+
1 row in set (0.01 sec)
